{
  "$schema": "http://json-schema.org/draft-07/schema#",
  "title": "AASStackStateManifest",
  "description": "State tracking manifest schema for autonomous multi-step agent workflows (aas-stack.json).",
  "type": "object",
  "required": [
    "stack_name",
    "current_phase",
    "step_index",
    "status"
  ],
  "properties": {
    "stack_name": {
      "type": "string",
      "description": "Identifier of the active workflow or stack (e.g. feature-development, bug-fix, saas-launch)."
    },
    "status": {
      "type": "string",
      "enum": ["initialized", "in_progress", "paused", "blocked", "completed", "failed"],
      "default": "initialized"
    },
    "current_phase": {
      "type": "string",
      "description": "Name of the active workflow phase (e.g. planning, tdd, review, deploy)."
    },
    "step_index": {
      "type": "integer",
      "minimum": 0,
      "description": "Zero-indexed sequential step counter."
    },
    "updated_at": {
      "type": "string",
      "description": "ISO-8601 timestamp of the last state modification."
    },
    "state_variables": {
      "type": "object",
      "description": "Arbitrary key-value store for session variables (e.g. baseline_commit, modified_files, port, framework)."
    },
    "plan_progress": {
      "type": "array",
      "items": {
        "type": "object",
        "required": ["step", "status"],
        "properties": {
          "step": {
            "type": "string",
            "description": "Description of the atomic step."
          },
          "status": {
            "type": "string",
            "enum": ["pending", "in_progress", "completed", "skipped", "failed"]
          },
          "skill_used": {
            "type": "string",
            "description": "Skill ID invoked for this step."
          },
          "notes": {
            "type": "string"
          }
        }
      },
      "description": "Checklist tracking step-by-step progress through the workflow."
    },
    "decisions_log": {
      "type": "array",
      "items": {
        "type": "object",
        "required": ["decision", "rationale"],
        "properties": {
          "timestamp": {
            "type": "string"
          },
          "decision": {
            "type": "string",
            "description": "Technical decision made."
          },
          "rationale": {
            "type": "string",
            "description": "Why this decision was chosen over alternatives."
          }
        }
      },
      "description": "Lightweight architectural decision records (ADRs) logged during the session."
    }
  },
  "additionalProperties": true
}
