{
  "$schema": "../schemas/aas-stack.schema.json",
  "stack_name": "feature-development",
  "status": "initialized",
  "current_phase": "planning",
  "step_index": 0,
  "updated_at": "2026-09-20T09:40:00Z",
  "state_variables": {
    "target_files": [],
    "baseline_commit": "",
    "test_command": "python scripts/skills/skills.py test",
    "primary_language": "python"
  },
  "plan_progress": [
    {
      "step": "Phase 1: Brainstorming & Requirements Refinement",
      "status": "pending",
      "skill_used": "active.brainstorming",
      "notes": "Clarify design scope and invariants"
    },
    {
      "step": "Phase 2: Granular Task Breakdown",
      "status": "pending",
      "skill_used": "active.concise-planning",
      "notes": "Produce 2-5 minute atomic action checklist"
    },
    {
      "step": "Phase 3: API & Contract Specification",
      "status": "pending",
      "skill_used": "active.api-and-interface-design",
      "notes": "Define type signatures and error models"
    },
    {
      "step": "Phase 4: Test-Driven Implementation (TDD)",
      "status": "pending",
      "skill_used": "active.tdd",
      "notes": "Red-Green-Refactor cycles"
    },
    {
      "step": "Phase 5: Automated Verification & Syntax Checks",
      "status": "pending",
      "skill_used": "active.verification-before-completion",
      "notes": "Run AST gate and regression tests"
    },
    {
      "step": "Phase 6: Code Review & Simplification",
      "status": "pending",
      "skill_used": "active.code-reviewer",
      "notes": "Check for security and anti-patterns"
    },
    {
      "step": "Phase 7: Changelog & Release Staging",
      "status": "pending",
      "skill_used": "active.changelog-automation",
      "notes": "Format patch summary and commit"
    }
  ],
  "decisions_log": []
}
